experiment	val_rmse	val_r2	status	description
no-git	0.070276	0.998710	baseline	baseline: LinearRegression no lag
no-git	0.070124	0.998716	keep	Ridge alpha=1.0
no-git	0.077503	0.998431	keep	RandomForest n=100
no-git	0.067889	0.998796	keep	GradientBoosting n=200 depth=4 lr=0.05
no-git	0.067255	0.998818	discard	Lasso alpha=0.01
no-git	0.069107	0.998752	keep	GradientBoosting n=400 depth=3 lr=0.03 sub=0.8
no-git	0.146272	0.994411	keep	HistGradientBoosting iter=300 depth=6 lr=0.05
no-git	0.071350	0.998670	keep	PolyFeatures degree=2 interactions + Ridge
no-git	0.082224	0.998234	keep	ExtraTrees n=200 njobs=-1
no-git	0.070274	0.998710	keep	Ridge alpha=0.01
no-git	0.066561	0.998843	keep	GBT n=300 depth=4 lr=0.04 sub=0.7 leaf=5
no-git	0.066292	0.998852	keep	GBT n=500 depth=4 lr=0.02 sub=0.7 leaf=5
no-git	0.069842	0.998726	discard	ElasticNet alpha=0.001 l1=0.5
no-git	0.070389	0.998706	keep	RandomForest n=300 depth=10 leaf=3
no-git	0.066148	0.998857	keep	GBT n=800 depth=4 lr=0.01 sub=0.7 leaf=5
loop	0.066148	0.998857	keep	iteration_2
auto	0.070253	0.998711	discard	Ridge alpha=0.1
auto	0.070253	0.998711	discard	Ridge alpha=5.0
auto	0.066256	0.998853	discard	GBT n=1000 depth=4 lr=0.008 sub=0.7
auto	0.064371	0.998918	keep	GBT n=800 depth=3 lr=0.01 sub=0.6
auto	0.064371	0.998918	discard	GBT n=800 depth=5 lr=0.01 sub=0.7
auto	0.071619	0.998660	discard	RandomForest n=500 depth=15 leaf=2
auto	0.070253	0.998711	discard	Ridge alpha=0.1
auto	0.070253	0.998711	discard	Ridge alpha=5.0
auto	0.066256	0.998853	discard	GBT n=1000 depth=4 lr=0.008 sub=0.7
auto	0.064371	0.998918	keep	GBT n=800 depth=3 lr=0.01 sub=0.6
auto	0.064371	0.998918	discard	GBT n=800 depth=5 lr=0.01 sub=0.7
auto	0.071619	0.998660	discard	RandomForest n=500 depth=15 leaf=2
auto	0.070253	0.998711	discard	Ridge alpha=0.1
auto	0.070253	0.998711	discard	Ridge alpha=5.0
auto	0.066256	0.998853	discard	GBT n=1000 depth=4 lr=0.008 sub=0.7
auto	0.064371	0.998918	keep	GBT n=800 depth=3 lr=0.01 sub=0.6
auto	0.069796	0.998727	discard	GBT n=800 depth=5 lr=0.01 sub=0.7
auto	0.071619	0.998660	discard	RandomForest n=500 depth=15 leaf=2
auto	0.070253	0.998711	discard	Ridge alpha=0.1
auto	0.070253	0.998711	discard	Ridge alpha=5.0
auto	0.066256	0.998853	discard	GBT n=1000 depth=4 lr=0.008 sub=0.7
auto	0.064371	0.998918	keep	GBT n=800 depth=3 lr=0.01 sub=0.6
auto	0.064371	0.998918	discard	GBT n=800 depth=5 lr=0.01 sub=0.7
auto	0.071619	0.998660	discard	RandomForest n=500 depth=15 leaf=2
auto	0.070253	0.998711	discard	Ridge alpha=0.1
auto	0.070253	0.998711	discard	Ridge alpha=5.0
auto	0.066256	0.998853	discard	GBT n=1000 depth=4 lr=0.008 sub=0.7
auto	0.064371	0.998918	keep	GBT n=800 depth=3 lr=0.01 sub=0.6
auto	0.069796	0.998727	discard	GBT n=800 depth=5 lr=0.01 sub=0.7
auto	0.071619	0.998660	discard	RandomForest n=500 depth=15 leaf=2
auto	0.070253	0.998711	discard	Ridge alpha=0.1
auto	0.070253	0.998711	discard	Ridge alpha=5.0
auto	0.066256	0.998853	discard	GBT n=1000 depth=4 lr=0.008 sub=0.7
auto	0.064371	0.998918	keep	GBT n=800 depth=3 lr=0.01 sub=0.6
auto	0.069796	0.998727	discard	GBT n=800 depth=5 lr=0.01 sub=0.7
auto	0.071619	0.998660	discard	RandomForest n=500 depth=15 leaf=2
auto	0.070253	0.998711	discard	Ridge alpha=0.1
auto	0.070253	0.998711	discard	Ridge alpha=5.0
auto	0.066256	0.998853	discard	GBT n=1000 depth=4 lr=0.008 sub=0.7
auto	0.064371	0.998918	keep	GBT n=800 depth=3 lr=0.01 sub=0.6
auto	0.064371	0.998918	discard	GBT n=800 depth=5 lr=0.01 sub=0.7
auto	0.071619	0.998660	discard	RandomForest n=500 depth=15 leaf=2
w4	0.063802	0.998937	keep	GBT n=600 depth=3 lr=0.01 sub=0.6 [axis:n_estimators]
w4	0.064834	0.998902	discard	GBT n=1000 depth=3 lr=0.01 sub=0.6 [axis:n_estimators]
w4	0.064834	0.998902	discard	GBT n=1500 depth=3 lr=0.01 sub=0.6 [axis:n_estimators]
w4	0.070146	0.998715	discard	GBT n=800 depth=3 lr=0.005 sub=0.6 [axis:learning_rate]
w4	0.065478	0.998880	discard	GBT n=800 depth=3 lr=0.02 sub=0.6 [axis:learning_rate]
w4	0.064167	0.998924	discard	GBT n=800 depth=3 lr=0.01 sub=0.5 [axis:subsample]
w4	0.064167	0.998924	discard	GBT n=800 depth=3 lr=0.01 sub=0.8 [axis:subsample]
w4	0.066423	0.998848	discard	GBT n=800 depth=3 lr=0.01 sub=0.6 leaf=2 [axis:min_samples_leaf]
w4	0.063802	0.998937	discard	GBT n=600 depth=3 lr=0.01 sub=0.6 [axis:n_estimators]
w4	0.064834	0.998902	discard	GBT n=1000 depth=3 lr=0.01 sub=0.6 [axis:n_estimators]
w4	0.065546	0.998878	discard	GBT n=1500 depth=3 lr=0.01 sub=0.6 [axis:n_estimators]
w4	0.070146	0.998715	discard	GBT n=800 depth=3 lr=0.005 sub=0.6 [axis:learning_rate]
w4	0.065478	0.998880	discard	GBT n=800 depth=3 lr=0.02 sub=0.6 [axis:learning_rate]
w4	0.064167	0.998924	discard	GBT n=800 depth=3 lr=0.01 sub=0.5 [axis:subsample]
w4	0.064332	0.998919	discard	GBT n=800 depth=3 lr=0.01 sub=0.8 [axis:subsample]
w4	0.066423	0.998848	discard	GBT n=800 depth=3 lr=0.01 sub=0.6 leaf=2 [axis:min_samples_leaf]
cf17458	0.064213	0.998923	discard	GBT n_estimators=800 subsample=0.7
cf17458	0.066078	0.998859	discard	GBT min_samples_leaf=1
cf17458	0.064371	0.998918	discard	GBT n_estimators=800
cf17458	0.065176	0.998890	discard	GBT max_depth=4
cf17458	0.064127	0.998926	discard	GBT learning_rate=0.008
cf17458	0.063671	0.998941	keep	GBT subsample=0.7
b4a01ef	0.159155	0.993383	keep	XGBoost n=600 depth=3 lr=0.01 sub=0.7 col=0.8
b4a01ef	0.063671	0.998941	discard	XGBoost n=600 depth=3 lr=0.01 sub=0.7 col=0.8
b4a01ef	0.163335	0.993031	keep	XGBoost n=1000 depth=3 lr=0.01 sub=0.7 lambda=0
b4a01ef	0.063671	0.998941	discard	XGBoost n=1000 depth=3 lr=0.01 lambda=0
b4a01ef	0.070594	0.998698	keep	LightGBM n=800 leaves=31 lr=0.01 sub=0.7 col=0.8
b4a01ef	0.063671	0.998941	discard	LightGBM n=800 leaves=31 lr=0.01
b4a01ef	0.066377	0.998849	keep	LightGBM n=1000 depth=3 leaves=8 lr=0.01 sub=0.7
b4a01ef	0.063671	0.998941	discard	LightGBM depth=3 leaves=8
b4a01ef	0.063862	0.998935	keep	FeatEng: sin/cos week + cat*retailer + GBT n=600
b4a01ef	0.063671	0.998941	discard	FeatEng sin/cos week + cat*retailer
b4a01ef	0.063749	0.998938	keep	FeatEng: week_of_year + log_price + cat*retailer + GBT
b4a01ef	0.063671	0.998941	discard	FeatEng week_of_year+log_price+cat*ret
b4a01ef	0.143453	0.994624	keep	HistGBT max_iter=600 depth=3 lr=0.01 leaf=5
b4a01ef	0.063671	0.998941	discard	HistGBT depth=3 lr=0.01
b4a01ef	0.220772	0.987268	keep	SVR RBF C=10 epsilon=0.01 gamma=scale
b4a01ef	0.063671	0.998941	discard	SVR RBF C=10
b4a01ef	0.063678	0.998941	keep	OHE category+retailer + GBT n=600 depth=3 lr=0.01
b4a01ef	0.063671	0.998941	discard	OHE category+retailer + GBT
b4a01ef	0.067969	0.998793	keep	GBT n=600 depth=3 lr=0.01 sub=0.7 max_feat=sqrt
b4a01ef	0.063671	0.998941	discard	GBT max_features=sqrt
b4a01ef	0.070148	0.998715	keep	Stacking GBT+Ridge -> Ridge meta
b4a01ef	0.063671	0.998941	discard	Stacking GBT+Ridge meta
b4a01ef	0.063658	0.998941	keep	GBT huber loss alpha=0.9 n=600 depth=3 lr=0.01 sub=0.7
b4a01ef	0.063432	0.998949	keep	GBT huber alpha=0.95 n=600 depth=3 lr=0.01 sub=0.7
b4a01ef	0.063795	0.998937	keep	GBT huber alpha=0.99 n=600 depth=3 lr=0.01 sub=0.7
b4a01ef	0.063432	0.998949	discard	GBT huber alpha=0.99
b4a01ef	0.064034	0.998929	keep	GBT huber alpha=0.95 n=800 depth=3 lr=0.01 sub=0.7
b4a01ef	0.063432	0.998949	discard	GBT huber alpha=0.95 n=800
b4a01ef	0.063522	0.998946	keep	GBT huber=0.95 + FeatEng week_of_year+cat*ret+log_price
b4a01ef	0.063432	0.998949	discard	GBT huber + FeatEng
b4a01ef	0.063416	0.998950	keep	GBT huber alpha=0.95 n=600 depth=3 lr=0.01 sub=0.65
b4a01ef	0.063612	0.998943	keep	GBT huber alpha=0.95 n=600 depth=3 lr=0.01 sub=0.60
b4a01ef	0.063416	0.998950	discard	GBT huber sub=0.60
b4a01ef	0.064339	0.998919	keep	GBT huber alpha=0.95 sub=0.65 leaf=3
161365f	0.064672	0.998907	keep	GBT huber alpha=0.95 n=600 depth=3 lr=0.01 sub=0.67
161365f	0.065676	0.998873	keep	GBT huber alpha=0.95 n=650 depth=3 lr=0.01 sub=0.65
161365f	0.067233	0.998819	keep	GBT huber alpha=0.95 n=600 depth=3 lr=0.01 sub=0.65 max_feat=log2
161365f	0.063962	0.998931	keep	GBT huber alpha=0.95 depth=3 lr=0.01 sub=0.65 early_stop n_no_change=20
161365f	0.063842	0.998935	keep	GBT huber alpha=0.95 n=600 depth=3 lr=0.01 sub=0.65 ccp_alpha=0.0001
161365f	0.064633	0.998909	keep	GBT huber alpha=0.95 n=600 depth=3 lr=0.01 sub=0.65 min_samples_split=4
161365f	0.063513	0.998946	keep	GBT huber alpha=0.95 n=500 depth=3 lr=0.01 sub=0.65
161365f	0.063212	0.998956	keep	GBT huber alpha=0.93 n=600 depth=3 lr=0.01 sub=0.65
161365f	0.063149	0.998958	keep	GBT huber alpha=0.92 n=600 depth=3 lr=0.01 sub=0.65
161365f	0.063293	0.998954	keep	GBT huber alpha=0.91 n=600 depth=3 lr=0.01 sub=0.65
